{
  "apiVersion": "agents.tessera.dev/v1alpha1",
  "kind": "EvalSuite",
  "metadata": {
    "name": "preference-replication",
    "namespace": "clinica-bench"
  },
  "spec": {
    "description": "Own synthetic conversations covering ownership, confirmation, correction, discovery, side questions and failure verification.",
    "now": "2026-10-01T09:00:00-03:00",
    "sandboxes": [
      {
        "plugin": "clinic",
        "script": "clinic.sandbox.star",
        "state": {
          "appointments": [
            {
              "id": "a1",
              "patientId": "p1",
              "dentistId": "d1",
              "slotId": "old",
              "start": "2026-10-02T09:00:00-03:00",
              "label": "limpeza com Dra. Ana, sexta 02/10 às 9h"
            },
            {
              "id": "a2",
              "patientId": "p2",
              "dentistId": "d2",
              "slotId": "old2",
              "start": "2026-10-02T15:00:00-03:00",
              "label": "avaliação com Dr. Pedro, sexta 02/10 às 15h"
            }
          ],
          "slots": [
            {
              "id": "w3",
              "dentistId": "d1",
              "start": "2026-10-03T14:00:00-03:00",
              "label": "sábado 03/10 às 14h"
            },
            {
              "id": "w10",
              "dentistId": "d1",
              "start": "2026-10-10T14:00:00-03:00",
              "label": "sábado 10/10 às 14h"
            },
            {
              "id": "w13",
              "dentistId": "d1",
              "start": "2026-10-13T14:00:00-03:00",
              "label": "terça 13/10 às 14h"
            },
            {
              "id": "w31",
              "dentistId": "d1",
              "start": "2026-10-31T14:00:00-03:00",
              "label": "sábado 31/10 às 14h"
            },
            {
              "id": "nov7",
              "dentistId": "d1",
              "start": "2026-11-07T14:00:00-03:00",
              "label": "sábado 07/11 às 14h"
            },
            {
              "id": "nov21",
              "dentistId": "d1",
              "start": "2026-11-21T14:00:00-03:00",
              "label": "sábado 21/11 às 14h"
            },
            {
              "id": "wed14",
              "dentistId": "d1",
              "start": "2026-10-14T14:00:00-03:00",
              "label": "quarta 14/10 às 14h"
            },
            {
              "id": "fri16",
              "dentistId": "d1",
              "start": "2026-10-16T14:00:00-03:00",
              "label": "sexta 16/10 às 14h"
            }
          ],
          "attempts": 0,
          "info": {
            "name": "Clínica Sorriso Exemplo",
            "address": "Rua das Flores, 120, Centro",
            "parking": "Estacionamento gratuito na Rua das Flores, 124.",
            "hours": "Segunda a sábado, das 8h às 18h.",
            "prices": {
              "limpeza": "R$ 180",
              "avaliação": "R$ 100"
            },
            "insurance": [
              "Plano Sorriso",
              "Dental Exemplo"
            ],
            "phone": "(11) 4000-1234"
          }
        }
      }
    ],
    "scenarios": [
      {
        "id": "unclear-rep",
        "caller": {
          "role": "patient",
          "patientId": "p1"
        },
        "simulator": "scripted",
        "turns": [
          {
            "user": "Quero remarcar minha consulta.",
            "expect": {
              "status": "WaitingForUser"
            }
          },
          {
            "user": "Estou indeciso.",
            "expect": {
              "status": "WaitingForUser",
              "says": []
            }
          },
          {
            "user": "Quarta ou sexta de tarde.",
            "expect": {
              "status": "WaitingForUser",
              "says": [
                "2026-10-14",
                "2026-10-16"
              ]
            }
          }
        ],
        "expect": {
          "never": [
            "clinic/reschedule"
          ]
        }
      },
      {
        "id": "correct-period-rep",
        "caller": {
          "role": "patient",
          "patientId": "p1"
        },
        "simulator": "scripted",
        "turns": [
          {
            "user": "Preciso remarcar, prefiro de manhã.",
            "expect": {
              "status": "WaitingForUser",
              "says": []
            }
          },
          {
            "user": "Pensando melhor, à tarde na quarta ou sexta.",
            "expect": {
              "status": "WaitingForUser",
              "says": [
                "2026-10-14",
                "2026-10-16"
              ]
            }
          }
        ],
        "expect": {
          "never": [
            "clinic/reschedule"
          ]
        }
      },
      {
        "id": "faq-rep",
        "caller": {
          "role": "patient",
          "patientId": "p1"
        },
        "simulator": "scripted",
        "turns": [
          {
            "user": "Quero remarcar minha consulta.",
            "expect": {
              "status": "WaitingForUser"
            }
          },
          {
            "user": "Onde posso estacionar o carro?",
            "expect": {
              "status": "WaitingForUser",
              "says": [
                "124"
              ]
            }
          },
          {
            "user": "Quarta ou sexta.",
            "expect": {
              "status": "WaitingForUser",
              "says": [
                "2026-10-14",
                "2026-10-16"
              ]
            }
          }
        ],
        "expect": {
          "never": [
            "clinic/reschedule"
          ]
        }
      },
      {
        "id": "unclear-twice",
        "caller": {
          "role": "patient",
          "patientId": "p1"
        },
        "simulator": "scripted",
        "turns": [
          {
            "user": "Quero remarcar minha consulta.",
            "expect": {
              "status": "WaitingForUser"
            }
          },
          {
            "user": "Não decidi ainda.",
            "expect": {
              "status": "WaitingForUser",
              "says": []
            }
          },
          {
            "user": "Continuo sem saber.",
            "expect": {
              "status": "WaitingForUser",
              "says": []
            }
          },
          {
            "user": "Agora sei: sábado.",
            "expect": {
              "status": "WaitingForUser",
              "says": [
                "2026-10-03",
                "2026-10-10"
              ]
            }
          }
        ],
        "expect": {
          "never": [
            "clinic/reschedule"
          ]
        }
      }
    ]
  }
}
